{
  "id": "ddr4_known_target_anybit_v1",
  "profile": "ddr4_vts25_v1",
  "standard": "DDR4",
  "mitigation": {
    "name": "none",
    "params": {}
  },
  "disclosure": {
    "mapping": "physical",
    "adjacency": "exact",
    "victim": "exact",
    "profile": "public_profile_id",
    "feedback": "summarized_counts"
  },
  "objective": {
    "type": "target_row_flip",
    "target": {
      "bank": "sampled",
      "row": "sampled"
    }
  },
  "budgets": {
    "tool_calls": 200,
    "acts": 100000,
    "cycles": 5000000
  },
  "reward": "sparse_success"
}
